{
  "protocol_version": "1.0",
  "message_type": "answer.text.submit",
  "session_id": "018f0000-0000-7000-8000-000000000101",
  "sequence": 3,
  "idempotency_key": "answer-text-submit-0001",
  "correlation_id": "018f0000-0000-7000-8000-000000000203",
  "sent_at": "2026-08-14T00:01:30Z",
  "payload": {
    "answer_turn_id": "018f0000-0000-7000-8000-000000000401",
    "text": "복구 목표를 정의하고 장애 주입으로 검증했습니다."
  }
}
